{
  "schema": "digi-mon/quality-baseline@1",
  "reviewAxes": [
    "curriculum-alignment",
    "answer-correctness",
    "wording-naturalness",
    "distractor-quality",
    "perceived-difficulty",
    "repetition"
  ],
  "reviewRatings": {
    "core": [
      "pass",
      "fix",
      "undecidable",
      "n-a"
    ],
    "perceivedDifficulty": [
      "match",
      "easier",
      "harder",
      "undecidable"
    ],
    "repetition": [
      "varied",
      "repetitive",
      "undecidable"
    ]
  },
  "caseCount": 24,
  "itemsPerCase": 10,
  "totalItems": 240,
  "cases": [
    {
      "id": "WS-M12-D1",
      "seed": "review-ws-m12-d1",
      "options": {
        "subject": "math",
        "gradeBands": [
          "1-2"
        ],
        "count": 10,
        "difficulty": 1
      },
      "worksheetFingerprint": "55cc5435e1f9c6fbb2d95f1b7a292f77771a5080245011c129abf1b7566d022c",
      "standardsUsed": [
        "[2수01-02]",
        "[2수01-04]",
        "[2수01-05]",
        "[2수01-06]",
        "[2수02-01]",
        "[2수03-01]",
        "[2수03-02]",
        "[2수03-05]",
        "[2수03-07]",
        "[2수04-02]"
      ],
      "difficultyHistogram": {
        "1": 10
      }
    },
    {
      "id": "WS-M12-D2",
      "seed": "review-ws-m12-d2",
      "options": {
        "subject": "math",
        "gradeBands": [
          "1-2"
        ],
        "count": 10,
        "difficulty": 2
      },
      "worksheetFingerprint": "8deca7a09ae3af5a330a39cc5b229db8fdc303d993df262e2a9dba779a6346eb",
      "standardsUsed": [
        "[2수01-03]",
        "[2수01-05]",
        "[2수01-07]",
        "[2수01-08]",
        "[2수01-11]",
        "[2수03-04]",
        "[2수03-09]",
        "[2수03-11]",
        "[2수03-13]",
        "[2수04-02]"
      ],
      "difficultyHistogram": {
        "2": 10
      }
    },
    {
      "id": "WS-M12-D3",
      "seed": "review-ws-m12-d3",
      "options": {
        "subject": "math",
        "gradeBands": [
          "1-2"
        ],
        "count": 10,
        "difficulty": 3
      },
      "worksheetFingerprint": "4e151b71014ecf58205c622e0ce2215135959788a6857fb1a90bbdb85781ee97",
      "standardsUsed": [
        "[2수01-02]",
        "[2수01-04]",
        "[2수01-05]",
        "[2수01-08]",
        "[2수01-09]",
        "[2수03-04]",
        "[2수03-05]",
        "[2수03-08]",
        "[2수03-12]",
        "[2수03-13]"
      ],
      "difficultyHistogram": {
        "3": 10
      }
    },
    {
      "id": "WS-M34-D1",
      "seed": "review-ws-m34-d1",
      "options": {
        "subject": "math",
        "gradeBands": [
          "3-4"
        ],
        "count": 10,
        "difficulty": 1
      },
      "worksheetFingerprint": "247d7f40861cd012fd1513ba17c7ced196893c270e65325a7e1ca305d3c39a67",
      "standardsUsed": [
        "[4수01-13]",
        "[4수01-14]",
        "[4수03-04]",
        "[4수03-05]",
        "[4수03-09]",
        "[4수03-10]",
        "[4수03-18]",
        "[4수03-19]",
        "[4수03-23]",
        "[4수03-25]"
      ],
      "difficultyHistogram": {
        "1": 10
      }
    },
    {
      "id": "WS-M34-D2",
      "seed": "review-ws-m34-d2",
      "options": {
        "subject": "math",
        "gradeBands": [
          "3-4"
        ],
        "count": 10,
        "difficulty": 2
      },
      "worksheetFingerprint": "2348eddd8157baf222ccbf532ce11d92ba8d33a9bc6b0e983ce05abbeb8a3ffa",
      "standardsUsed": [
        "[4수01-08]",
        "[4수01-09]",
        "[4수01-14]",
        "[4수03-01]",
        "[4수03-03]",
        "[4수03-10]",
        "[4수03-13]",
        "[4수03-17]",
        "[4수03-18]",
        "[4수04-02]"
      ],
      "difficultyHistogram": {
        "1": 2,
        "2": 8
      }
    },
    {
      "id": "WS-M34-D3",
      "seed": "review-ws-m34-d3",
      "options": {
        "subject": "math",
        "gradeBands": [
          "3-4"
        ],
        "count": 10,
        "difficulty": 3
      },
      "worksheetFingerprint": "48820c6786b342b0a80fdc2c4e7c7db127fc644e508b773cf761ffda7c5573d8",
      "standardsUsed": [
        "[4수01-07]",
        "[4수01-11]",
        "[4수01-15]",
        "[4수02-03]",
        "[4수03-01]",
        "[4수03-05]",
        "[4수03-14]",
        "[4수03-17]",
        "[4수03-25]",
        "[4수04-02]"
      ],
      "difficultyHistogram": {
        "1": 1,
        "3": 9
      }
    },
    {
      "id": "WS-M56-D1",
      "seed": "review-ws-m56-d1",
      "options": {
        "subject": "math",
        "gradeBands": [
          "5-6"
        ],
        "count": 10,
        "difficulty": 1
      },
      "worksheetFingerprint": "2444a67e3199533bb52c441ca995da9d56357503dfa07ec909b64173a757d0b2",
      "standardsUsed": [
        "[6수01-03]",
        "[6수01-04]",
        "[6수01-06]",
        "[6수01-09]",
        "[6수02-03]",
        "[6수03-01]",
        "[6수03-02]",
        "[6수03-03]",
        "[6수03-07]",
        "[6수03-08]"
      ],
      "difficultyHistogram": {
        "1": 10
      }
    },
    {
      "id": "WS-M56-D2",
      "seed": "review-ws-m56-d2",
      "options": {
        "subject": "math",
        "gradeBands": [
          "5-6"
        ],
        "count": 10,
        "difficulty": 2
      },
      "worksheetFingerprint": "2c43f50cace0ec953e91bbc5d5166e409adcbaf66da0d51641a8067543e5f6cf",
      "standardsUsed": [
        "[6수01-06]",
        "[6수01-12]",
        "[6수01-15]",
        "[6수02-02]",
        "[6수02-03]",
        "[6수02-05]",
        "[6수03-06]",
        "[6수03-11]",
        "[6수03-12]",
        "[6수04-06]"
      ],
      "difficultyHistogram": {
        "1": 1,
        "2": 9
      }
    },
    {
      "id": "WS-M56-D3",
      "seed": "review-ws-m56-d3",
      "options": {
        "subject": "math",
        "gradeBands": [
          "5-6"
        ],
        "count": 10,
        "difficulty": 3
      },
      "worksheetFingerprint": "fdd4b795948ae6de93b5a9cff94570d794596010f62a31bff4304caf529a09eb",
      "standardsUsed": [
        "[6수01-04]",
        "[6수01-11]",
        "[6수01-14]",
        "[6수01-15]",
        "[6수02-05]",
        "[6수03-03]",
        "[6수03-14]",
        "[6수04-01]",
        "[6수04-03]",
        "[6수04-05]"
      ],
      "difficultyHistogram": {
        "3": 10
      }
    },
    {
      "id": "WS-K12-D1",
      "seed": "review-ws-k12-d1",
      "options": {
        "subject": "korean",
        "gradeBands": [
          "1-2"
        ],
        "count": 10,
        "difficulty": 1
      },
      "worksheetFingerprint": "d8d8650b20293f56d7e0687fabe4e45b0c20501828454c09b1fb51c7c6be8b31",
      "standardsUsed": [
        "[2국02-02]",
        "[2국02-04]",
        "[2국03-01]",
        "[2국04-01]",
        "[2국04-02]",
        "[2국04-03]"
      ],
      "difficultyHistogram": {
        "1": 10
      }
    },
    {
      "id": "WS-K12-D2",
      "seed": "review-ws-k12-d2",
      "options": {
        "subject": "korean",
        "gradeBands": [
          "1-2"
        ],
        "count": 10,
        "difficulty": 2
      },
      "worksheetFingerprint": "efff98d812822f7d002919c4a98bfd5da2af9c9e746ec1eabd9b70e6da5a32b6",
      "standardsUsed": [
        "[2국02-02]",
        "[2국02-04]",
        "[2국03-01]",
        "[2국04-01]",
        "[2국04-02]",
        "[2국04-03]"
      ],
      "difficultyHistogram": {
        "1": 4,
        "2": 6
      }
    },
    {
      "id": "WS-K12-D3",
      "seed": "review-ws-k12-d3",
      "options": {
        "subject": "korean",
        "gradeBands": [
          "1-2"
        ],
        "count": 10,
        "difficulty": 3
      },
      "worksheetFingerprint": "b966e4aa1917001620c9a6d3e3e431f1703a5f9ec0f3a42b7cdce3c43f8e4958",
      "standardsUsed": [
        "[2국02-02]",
        "[2국02-04]",
        "[2국03-01]",
        "[2국04-01]",
        "[2국04-02]",
        "[2국04-03]"
      ],
      "difficultyHistogram": {
        "1": 5,
        "3": 5
      }
    },
    {
      "id": "WS-K34-D1",
      "seed": "review-ws-k34-d1",
      "options": {
        "subject": "korean",
        "gradeBands": [
          "3-4"
        ],
        "count": 10,
        "difficulty": 1
      },
      "worksheetFingerprint": "40d6748c20a06a5655750ba099dd34057432543543cae365b6d234655f7bf49a",
      "standardsUsed": [
        "[4국02-04]",
        "[4국03-02]",
        "[4국03-03]",
        "[4국04-01]",
        "[4국04-02]",
        "[4국04-03]",
        "[4국04-04]",
        "[4국05-04]"
      ],
      "difficultyHistogram": {
        "1": 10
      }
    },
    {
      "id": "WS-K34-D2",
      "seed": "review-ws-k34-d2",
      "options": {
        "subject": "korean",
        "gradeBands": [
          "3-4"
        ],
        "count": 10,
        "difficulty": 2
      },
      "worksheetFingerprint": "6b7c43ac370e999550e00bd780bf682a908949990de1493a4f16b4543f5f742f",
      "standardsUsed": [
        "[4국02-04]",
        "[4국03-02]",
        "[4국03-03]",
        "[4국04-01]",
        "[4국04-02]",
        "[4국04-03]",
        "[4국04-04]",
        "[4국05-04]"
      ],
      "difficultyHistogram": {
        "1": 2,
        "2": 8
      }
    },
    {
      "id": "WS-K34-D3",
      "seed": "review-ws-k34-d3",
      "options": {
        "subject": "korean",
        "gradeBands": [
          "3-4"
        ],
        "count": 10,
        "difficulty": 3
      },
      "worksheetFingerprint": "6983293c27b9d2b28337685a25cffc68db5a2215289b1bbb6ce31fe5ccdad0d0",
      "standardsUsed": [
        "[4국02-04]",
        "[4국03-02]",
        "[4국03-03]",
        "[4국04-01]",
        "[4국04-02]",
        "[4국04-03]",
        "[4국04-04]",
        "[4국05-04]"
      ],
      "difficultyHistogram": {
        "1": 2,
        "3": 8
      }
    },
    {
      "id": "WS-K56-D1",
      "seed": "review-ws-k56-d1",
      "options": {
        "subject": "korean",
        "gradeBands": [
          "5-6"
        ],
        "count": 10,
        "difficulty": 1
      },
      "worksheetFingerprint": "af573894a3fc68bd3032383c626c7f5c0d746692a091df113dd882b42b30e984",
      "standardsUsed": [
        "[6국01-01]",
        "[6국01-02]",